{
  "$schema": "https://json-schema.org/draft/2020-12/schema",
  "$id": "https://raw.githubusercontent.com/Sean2603/clinical-decision-assessments/main/schema/procedure-schema.json",
  "title": "Clinical skill / procedure",
  "type": "object",
  "additionalProperties": false,
  "required": [
    "id",
    "title",
    "version",
    "minimumAppVersion",
    "status",
    "summary",
    "category",
    "indications",
    "contraindications",
    "precautions",
    "equipment",
    "preparation",
    "steps",
    "complications",
    "troubleshooting",
    "aftercare",
    "documentation",
    "escalation",
    "competency",
    "references",
    "prominentResources",
    "attachments",
    "clinicalValidation"
  ],
  "properties": {
    "id": {
      "type": "string",
      "pattern": "^[a-z0-9_-]+$"
    },
    "title": {
      "type": "string",
      "minLength": 1
    },
    "version": {
      "type": "string",
      "pattern": "^\\d+\\.\\d+\\.\\d+$"
    },
    "minimumAppVersion": {
      "type": "string",
      "pattern": "^\\d+\\.\\d+\\.\\d+$"
    },
    "status": {
      "enum": [
        "draft",
        "active",
        "withdrawn"
      ]
    },
    "summary": {
      "type": "string"
    },
    "category": {
      "type": "string",
      "minLength": 1
    },
    "indications": {
      "type": "array",
      "items": {
        "type": "string",
        "minLength": 1
      }
    },
    "contraindications": {
      "type": "array",
      "items": {
        "type": "string",
        "minLength": 1
      }
    },
    "precautions": {
      "$ref": "#/$defs/stringList"
    },
    "equipment": {
      "type": "array",
      "items": {
        "type": "string",
        "minLength": 1
      }
    },
    "preparation": {
      "type": "array",
      "items": {
        "type": "string",
        "minLength": 1
      }
    },
    "steps": {
      "type": "array",
      "items": {
        "$ref": "#/$defs/step"
      }
    },
    "complications": {
      "type": "array",
      "items": {
        "type": "string",
        "minLength": 1
      }
    },
    "troubleshooting": {
      "type": "array",
      "items": {
        "type": "string",
        "minLength": 1
      }
    },
    "aftercare": {
      "type": "array",
      "items": {
        "type": "string",
        "minLength": 1
      }
    },
    "documentation": {
      "type": "array",
      "items": {
        "type": "string",
        "minLength": 1
      }
    },
    "escalation": {
      "type": "array",
      "items": {
        "type": "string",
        "minLength": 1
      }
    },
    "competency": {
      "type": "array",
      "items": {
        "type": "string",
        "minLength": 1
      }
    },
    "references": {
      "allOf": [
        {
          "type": "array",
          "items": {
            "type": "string",
            "minLength": 1
          }
        },
        {
          "uniqueItems": true
        }
      ]
    },
    "prominentResources": {
      "type": "array",
      "items": {
        "$ref": "#/$defs/prominentResource"
      },
      "default": []
    },
    "attachments": {
      "type": "array",
      "items": {
        "$ref": "#/$defs/clinicalAttachment"
      }
    },
    "clinicalValidation": {
      "$ref": "#/$defs/clinicalValidation"
    }
  },
  "$defs": {
    "stringList": {
      "type": "array",
      "items": {
        "type": "string",
        "minLength": 1
      }
    },
    "step": {
      "type": "object",
      "additionalProperties": false,
      "required": [
        "id",
        "title",
        "instruction",
        "cautions",
        "tips",
        "imageAttachmentId"
      ],
      "properties": {
        "id": {
          "type": "string",
          "pattern": "^[a-z0-9_-]+$"
        },
        "title": {
          "type": "string"
        },
        "instruction": {
          "type": "string",
          "minLength": 1
        },
        "cautions": {
          "$ref": "#/$defs/stringList"
        },
        "tips": {
          "$ref": "#/$defs/stringList"
        },
        "imageAttachmentId": {
          "type": [
            "string",
            "null"
          ],
          "minLength": 1
        }
      }
    },
    "clinicalValidation": {
      "type": "object",
      "additionalProperties": false,
      "required": [
        "validated",
        "reviewedBy",
        "reviewedOn",
        "reviewerRole",
        "nextReviewDue",
        "reviewNotes"
      ],
      "properties": {
        "validated": {
          "type": "boolean"
        },
        "reviewedBy": {
          "type": [
            "string",
            "null"
          ]
        },
        "reviewedOn": {
          "type": [
            "string",
            "null"
          ],
          "format": "date"
        },
        "reviewerRole": {
          "type": [
            "string",
            "null"
          ]
        },
        "nextReviewDue": {
          "type": [
            "string",
            "null"
          ],
          "format": "date"
        },
        "reviewNotes": {
          "type": [
            "string",
            "null"
          ]
        }
      }
    },
    "clinicalAttachmentReplacementGovernance": {
      "type": "object",
      "additionalProperties": false,
      "required": [
        "replacedOn",
        "replacedBy",
        "replacementReason",
        "changeSummary",
        "clinicalMeaningChanged",
        "requiresRevalidation",
        "sourceChecked",
        "previousPath",
        "previousVersion",
        "previousSha256"
      ],
      "properties": {
        "replacedOn": {
          "type": "string",
          "format": "date-time"
        },
        "replacedBy": {
          "type": "string",
          "minLength": 1
        },
        "replacementReason": {
          "type": "string",
          "minLength": 1
        },
        "changeSummary": {
          "type": "string",
          "minLength": 1
        },
        "clinicalMeaningChanged": {
          "type": "boolean"
        },
        "requiresRevalidation": {
          "type": "boolean"
        },
        "sourceChecked": {
          "type": "boolean"
        },
        "previousPath": {
          "type": "string",
          "pattern": "^attachments/"
        },
        "previousVersion": {
          "type": "string",
          "pattern": "^[0-9]+\\.[0-9]+\\.[0-9]+$"
        },
        "previousSha256": {
          "type": "string",
          "pattern": "^[A-Fa-f0-9]{64}$"
        }
      }
    },
    "clinicalAttachment": {
      "type": "object",
      "additionalProperties": false,
      "required": [
        "id",
        "type",
        "title",
        "label",
        "path",
        "caption",
        "source",
        "referenceId",
        "version",
        "sha256",
        "mediaType",
        "originalFileName",
        "fileSize",
        "width",
        "height",
        "uploadedOn",
        "uploadedBy",
        "replacementGovernance"
      ],
      "properties": {
        "id": {
          "type": "string",
          "minLength": 1
        },
        "type": {
          "enum": [
            "image",
            "pdf",
            "document",
            "spreadsheet",
            "presentation",
            "text"
          ]
        },
        "title": {
          "type": "string",
          "minLength": 1
        },
        "label": {
          "type": "string",
          "minLength": 1
        },
        "path": {
          "type": "string",
          "pattern": "^attachments/"
        },
        "caption": {
          "type": [
            "string",
            "null"
          ]
        },
        "source": {
          "type": [
            "string",
            "null"
          ]
        },
        "referenceId": {
          "type": [
            "string",
            "null"
          ]
        },
        "version": {
          "type": "string",
          "pattern": "^[0-9]+\\.[0-9]+\\.[0-9]+$"
        },
        "sha256": {
          "type": "string",
          "pattern": "^[A-Fa-f0-9]{64}$"
        },
        "mediaType": {
          "type": "string",
          "minLength": 1
        },
        "originalFileName": {
          "type": "string",
          "minLength": 1
        },
        "fileSize": {
          "type": [
            "integer",
            "null"
          ],
          "minimum": 0
        },
        "width": {
          "type": [
            "integer",
            "null"
          ],
          "minimum": 1
        },
        "height": {
          "type": [
            "integer",
            "null"
          ],
          "minimum": 1
        },
        "uploadedOn": {
          "type": "string",
          "format": "date-time"
        },
        "uploadedBy": {
          "type": "string",
          "minLength": 1
        },
        "replacementGovernance": {
          "anyOf": [
            {
              "$ref": "#/$defs/clinicalAttachmentReplacementGovernance"
            },
            {
              "type": "null"
            }
          ]
        }
      }
    },
    "prominentResource": {
      "type": "object",
      "additionalProperties": false,
      "required": [
        "label",
        "sourceType"
      ],
      "properties": {
        "label": {
          "type": "string",
          "minLength": 1
        },
        "sourceType": {
          "type": "string",
          "enum": [
            "url",
            "attachment"
          ]
        },
        "url": {
          "type": "string",
          "format": "uri"
        },
        "attachmentId": {
          "type": "string",
          "minLength": 1
        }
      },
      "allOf": [
        {
          "if": {
            "properties": {
              "sourceType": {
                "const": "url"
              }
            },
            "required": [
              "sourceType"
            ]
          },
          "then": {
            "required": [
              "url"
            ]
          }
        },
        {
          "if": {
            "properties": {
              "sourceType": {
                "const": "attachment"
              }
            },
            "required": [
              "sourceType"
            ]
          },
          "then": {
            "required": [
              "attachmentId"
            ]
          }
        }
      ]
    }
  }
}
